{
  "edges": [
    {
      "from": {
        "nodeId": "features-input",
        "portId": "values"
      },
      "gradientFlow": "notApplicable",
      "logicalShape": [
        {
          "axis": "batch",
          "size": null
        },
        {
          "axis": "sequence",
          "size": 3
        },
        {
          "axis": "feature",
          "size": 12
        }
      ],
      "to": {
        "nodeId": "context-preparation",
        "portId": "features"
      }
    },
    {
      "from": {
        "nodeId": "context-preparation",
        "portId": "prepared"
      },
      "gradientFlow": "notApplicable",
      "logicalShape": [
        {
          "axis": "batch",
          "size": null
        },
        {
          "axis": "sequence",
          "size": 3
        },
        {
          "axis": "contextFeature",
          "size": 24
        }
      ],
      "to": {
        "nodeId": "input-projection",
        "portId": "features"
      }
    },
    {
      "from": {
        "nodeId": "input-projection",
        "portId": "encoded"
      },
      "gradientFlow": "propagates",
      "logicalShape": [
        {
          "axis": "batch",
          "size": null
        },
        {
          "axis": "sequence",
          "size": 3
        },
        {
          "axis": "hidden",
          "size": 24
        }
      ],
      "to": {
        "nodeId": "positional-encoding",
        "portId": "encoded"
      }
    },
    {
      "from": {
        "nodeId": "positional-encoding",
        "portId": "positioned"
      },
      "gradientFlow": "propagates",
      "logicalShape": [
        {
          "axis": "batch",
          "size": null
        },
        {
          "axis": "sequence",
          "size": 3
        },
        {
          "axis": "hidden",
          "size": 24
        }
      ],
      "to": {
        "nodeId": "encoder-1",
        "portId": "sequence"
      }
    },
    {
      "from": {
        "nodeId": "context-preparation",
        "portId": "attention-mask"
      },
      "gradientFlow": "notApplicable",
      "logicalShape": [
        {
          "axis": "batch",
          "size": null
        },
        {
          "axis": "sequence",
          "size": 3
        }
      ],
      "to": {
        "nodeId": "encoder-1",
        "portId": "attention-mask"
      }
    },
    {
      "from": {
        "nodeId": "encoder-1",
        "portId": "sequence"
      },
      "gradientFlow": "propagates",
      "logicalShape": [
        {
          "axis": "batch",
          "size": null
        },
        {
          "axis": "sequence",
          "size": 3
        },
        {
          "axis": "hidden",
          "size": 24
        }
      ],
      "to": {
        "nodeId": "encoder-2",
        "portId": "sequence"
      }
    },
    {
      "from": {
        "nodeId": "context-preparation",
        "portId": "attention-mask"
      },
      "gradientFlow": "notApplicable",
      "logicalShape": [
        {
          "axis": "batch",
          "size": null
        },
        {
          "axis": "sequence",
          "size": 3
        }
      ],
      "to": {
        "nodeId": "encoder-2",
        "portId": "attention-mask"
      }
    },
    {
      "from": {
        "nodeId": "encoder-2",
        "portId": "sequence"
      },
      "gradientFlow": "propagates",
      "logicalShape": [
        {
          "axis": "batch",
          "size": null
        },
        {
          "axis": "sequence",
          "size": 3
        },
        {
          "axis": "hidden",
          "size": 24
        }
      ],
      "to": {
        "nodeId": "last-valid-selection",
        "portId": "sequence"
      }
    },
    {
      "from": {
        "nodeId": "last-valid-selection",
        "portId": "state"
      },
      "gradientFlow": "propagates",
      "logicalShape": [
        {
          "axis": "batch",
          "size": null
        },
        {
          "axis": "hidden",
          "size": 24
        }
      ],
      "to": {
        "nodeId": "target-0-raw",
        "portId": "state"
      }
    },
    {
      "from": {
        "nodeId": "target-0-raw",
        "portId": "raw"
      },
      "gradientFlow": "propagates",
      "logicalShape": [
        {
          "axis": "batch",
          "size": null
        }
      ],
      "to": {
        "nodeId": "target-0-loss-input",
        "portId": "raw"
      }
    },
    {
      "from": {
        "nodeId": "target-0-raw",
        "portId": "raw"
      },
      "gradientFlow": "propagates",
      "logicalShape": [
        {
          "axis": "batch",
          "size": null
        }
      ],
      "to": {
        "nodeId": "target-0-prediction",
        "portId": "raw"
      }
    },
    {
      "from": {
        "nodeId": "last-valid-selection",
        "portId": "state"
      },
      "gradientFlow": "propagates",
      "logicalShape": [
        {
          "axis": "batch",
          "size": null
        },
        {
          "axis": "hidden",
          "size": 24
        }
      ],
      "to": {
        "nodeId": "target-1-raw",
        "portId": "state"
      }
    },
    {
      "from": {
        "nodeId": "target-1-raw",
        "portId": "raw"
      },
      "gradientFlow": "propagates",
      "logicalShape": [
        {
          "axis": "batch",
          "size": null
        }
      ],
      "to": {
        "nodeId": "target-1-loss-input",
        "portId": "raw"
      }
    },
    {
      "from": {
        "nodeId": "target-1-raw",
        "portId": "raw"
      },
      "gradientFlow": "propagates",
      "logicalShape": [
        {
          "axis": "batch",
          "size": null
        }
      ],
      "to": {
        "nodeId": "target-1-prediction",
        "portId": "raw"
      }
    },
    {
      "from": {
        "nodeId": "last-valid-selection",
        "portId": "state"
      },
      "gradientFlow": "propagates",
      "logicalShape": [
        {
          "axis": "batch",
          "size": null
        },
        {
          "axis": "hidden",
          "size": 24
        }
      ],
      "to": {
        "nodeId": "target-2-raw",
        "portId": "state"
      }
    },
    {
      "from": {
        "nodeId": "target-2-raw",
        "portId": "raw"
      },
      "gradientFlow": "propagates",
      "logicalShape": [
        {
          "axis": "batch",
          "size": null
        }
      ],
      "to": {
        "nodeId": "target-2-loss-input",
        "portId": "raw"
      }
    },
    {
      "from": {
        "nodeId": "target-2-raw",
        "portId": "raw"
      },
      "gradientFlow": "propagates",
      "logicalShape": [
        {
          "axis": "batch",
          "size": null
        }
      ],
      "to": {
        "nodeId": "target-2-prediction",
        "portId": "raw"
      }
    },
    {
      "from": {
        "nodeId": "last-valid-selection",
        "portId": "state"
      },
      "gradientFlow": "propagates",
      "logicalShape": [
        {
          "axis": "batch",
          "size": null
        },
        {
          "axis": "hidden",
          "size": 24
        }
      ],
      "to": {
        "nodeId": "resource-0",
        "portId": "state"
      }
    },
    {
      "from": {
        "nodeId": "target-0-loss-input",
        "portId": "value"
      },
      "gradientFlow": "propagates",
      "logicalShape": [
        {
          "axis": "batch",
          "size": null
        }
      ],
      "to": {
        "nodeId": "direct-component-0",
        "portId": "estimate"
      }
    },
    {
      "from": {
        "nodeId": "observed-target-0",
        "portId": "value"
      },
      "gradientFlow": "notApplicable",
      "logicalShape": [
        {
          "axis": "batch",
          "size": null
        }
      ],
      "to": {
        "nodeId": "direct-component-0",
        "portId": "observed"
      }
    },
    {
      "from": {
        "nodeId": "direct-component-0",
        "portId": "weighted"
      },
      "gradientFlow": "propagates",
      "logicalShape": [],
      "to": {
        "nodeId": "total-loss",
        "portId": "component-0"
      }
    },
    {
      "from": {
        "nodeId": "target-1-loss-input",
        "portId": "value"
      },
      "gradientFlow": "propagates",
      "logicalShape": [
        {
          "axis": "batch",
          "size": null
        }
      ],
      "to": {
        "nodeId": "direct-component-1",
        "portId": "estimate"
      }
    },
    {
      "from": {
        "nodeId": "observed-target-1",
        "portId": "value"
      },
      "gradientFlow": "notApplicable",
      "logicalShape": [
        {
          "axis": "batch",
          "size": null
        }
      ],
      "to": {
        "nodeId": "direct-component-1",
        "portId": "observed"
      }
    },
    {
      "from": {
        "nodeId": "direct-component-1",
        "portId": "weighted"
      },
      "gradientFlow": "propagates",
      "logicalShape": [],
      "to": {
        "nodeId": "total-loss",
        "portId": "component-1"
      }
    },
    {
      "from": {
        "nodeId": "target-2-loss-input",
        "portId": "value"
      },
      "gradientFlow": "propagates",
      "logicalShape": [
        {
          "axis": "batch",
          "size": null
        }
      ],
      "to": {
        "nodeId": "direct-component-2",
        "portId": "estimate"
      }
    },
    {
      "from": {
        "nodeId": "observed-target-2",
        "portId": "value"
      },
      "gradientFlow": "notApplicable",
      "logicalShape": [
        {
          "axis": "batch",
          "size": null
        }
      ],
      "to": {
        "nodeId": "direct-component-2",
        "portId": "observed"
      }
    },
    {
      "from": {
        "nodeId": "direct-component-2",
        "portId": "weighted"
      },
      "gradientFlow": "propagates",
      "logicalShape": [],
      "to": {
        "nodeId": "total-loss",
        "portId": "component-2"
      }
    },
    {